[
  {
    "id": "khao_niaw",
    "name": {
      "en": "Sticky Rice",
      "lo": "ເຂົ້າໜຽວ",
      "hm": "mov blaum"
    },
    "transliteration": {
      "lo_to_latn": "ເຂົ້າໜຽວ",
      "hm_to_latn": "mov blaum"
    },
    "pronunciation": {
      "lo": "kăo nĭao",
      "hm": "mov blaum cub"
    },
    "category": "Staple",
    "description": {
      "en": "Glutinous rice steamed and served in a small basket; eaten with savory dishes or sweet sides.",
      "lo": "ເຂົ້າໜຽວໜີ້ງ ແນະນຳໃຫ້ກິນກັບເມນູອຸ່ນໆ, ເຜັດ ແລະ ແກງ",
      "hm": "mov blaum cub noj ntxuag nqaj ci..."
    },
    "ingredients": ["glutinous rice"],
    "allergens": [],
    "price": 10000,
    "currency": "LAK",
  "image": "https://ianbenites.com/wp-content/uploads/2020/08/LRM_20200811_204813.jpg",
    "tags": ["gluten-free", "vegan"],
    "cultural_notes": {
      "en": "Staple carbohydrate for many Lao and Hmong meals; often eaten by hand.",
      "lo": "ເຂົ້າໜຽວແຊບຫຼາຍ ແລະ ມັກກິນໂດຍໃຊ້ມື",
      "hm": "mov blaum cub noj ntxuag nqaj ci..."
    },
    "spice_level": 0,
    "recommended_pairings": ["Laap", "Grilled fish"],
    "availability": "All day",
    "preparation_time_minutes": 30
  },
  {
    "id": "laap",
    "name": {
      "en": "Laap (Larb) - Minced meat salad",
      "lo": "ລາບງົວ",
      "hm": "laj nyuj ntxim nqaab kawg"
    },
    "transliteration": {
      "lo_to_latn": "laap",
      "hm_to_latn": "laj"
    },
    "pronunciation": {
      "lo": "lâap",
      "hm": "laj nyuj ntxim nqaab kawg"
    },
    "category": "Main",
    "description": {
      "en": "Minced meat (or mushroom) salad flavored with fish sauce, lime, toasted rice powder and fresh herbs.",
      "lo": "ສຸ່ນເຂົ້າປອກ ຫຼືເຜີຍ ປຸງດ້ວຍນ້ໍາປາ ນ້ໍາມິວ ຂ້ອມຂຽວ ແລະ ຂ້ອມຂ້າມ",
      "hm": "laj nyuj ntxim nqaab kawg..."
    },
    "ingredients": ["minced pork", "fish sauce", "lime", "toasted rice powder", "herbs"],
    "allergens": ["fish"],
    "price": 20000,
    "currency": "LAK",
  "image": "https://avocadopesto.com/wp-content/uploads/2013/04/laap-4.jpg",
    "tags": ["spicy", "contains-fish"],
    "cultural_notes": {
      "en": "Often served at festivals and family gatherings; recipes vary by region and family.",
      "lo": "ມັກຈະສ່ວນໃນງານຉຳຂອງຄອບຄົວ ແລະ ງານມັນ",
      "hm": "[Hmong cultural note placeholder]"
    },
    "spice_level": 3,
    "recommended_pairings": ["Sticky Rice", "Fresh Vegetables"],
    "availability": "Lunch/Dinner",
    "preparation_time_minutes": 20
  }
  ,
  {
    "id": "grilled_fish",
    "name": {"en": "Grilled Fish", "lo": "ປີ້ງປາ", "hm": "Pa npo (placeholder)"},
    "transliteration": {"lo_to_latn": "pa piak", "hm_to_latn": "pa npo"},
    "pronunciation": {"lo": "pâa pîak", "hm": "[hmong pronunciation placeholder]"},
    "category": "Main",
    "description": {"en": "Whole fish grilled over charcoal, served with fresh herbs and lime.", "lo": "ປາທົ່ວແກ້ວປຸ່ງກະທົ່ວ ມີສົດແລະນ້ໍາມີວ", "hm": "[Hmong description placeholder]"},
    "ingredients": ["fish", "herbs", "lime"],
    "allergens": ["fish"],
    "price": 35000,
    "currency": "LAK",
  "image": "https://www.eatingthaifood.com/wp-content/uploads/2014/01/thai-grilled-fish-recipe-feature.jpg",
    "tags": ["grilled", "gluten-free"],
    "cultural_notes": {"en": "Commonly served at family meals and markets.", "lo": "ມັກຈະກິນຢູ່ຕະຫຼາດ ແລະ ງານຄອບຄົວ", "hm": "[Hmong cultural note placeholder]"},
    "spice_level": 1,
    "recommended_pairings": ["Sticky Rice", "Fresh Vegetables"],
    "availability": "Lunch/Dinner",
    "preparation_time_minutes": 25
  },
  {
  "id": "papaya_salad",
  "name": {
    "en": "Papaya Salad (Tam Mak Houng)",
    "lo": "ຕຳໝາກຫຸ່ງ",
    "hm": "xeeb txiv papaya"
  },
  "transliteration": {
    "lo_to_latn": "tam mak houng",
    "hm_to_latn": "xeeb papaya"
  },
  "pronunciation": {
    "lo": "tam mâk hûang",
    "hm": "xeeb txiv papaya"
  },
  "category": "Starter",
  "description": {
    "en": "Shredded green papaya tossed with lime, fish sauce, chilies and peanuts.",
    "lo": "ຕຳໝາກຫຸ່ງດິບ ປຸງດ້ວຍນ້ຳປາ ນ້ຳມະນາວ ໝາກເຜັດ ແລະ ຖົ່ວ",
    "hm": "papaya nyoos txiav nyias, tov nrog kua qaub, ntses ntses, kua txob thiab taum"
  },
  "ingredients": ["green papaya", "lime", "chilies", "peanuts"],
  "allergens": ["peanuts"],
  "price": 18000,
  "currency": "LAK",
  "image": "https://hot-thai-kitchen.com/wp-content/uploads/2016/06/papaya-salad-new-sq.jpg",
  "tags": ["spicy", "salad"],
  "cultural_notes": {
    "en": "A popular street food, refreshing on hot days.",
    "lo": "ເປັນອາຫານຂ້າງທາງທີ່ນິຍົມ ແລະ ກິນແລ້ວຮູ້ສຶກສົດຊື່ນໃນມື້ຮ້ອນ",
    "hm": "yog zaub mov nrov ntawm kev muag tom kev, noj thaum hnub kub ces ua kom txias siab"
  },
  "spice_level": 4,
  "recommended_pairings": ["Sticky Rice", "Grilled Chicken"],
  "availability": "All day",
  "preparation_time_minutes": 10
}
    ,
    {
  "id": "jaew_bong",
  "name": {
    "en": "Jaew Bong (Hot Pepper Dip)",
    "lo": "ແຈ່ວບອງ",
    "hm": "kua txob jeow bong"
  },
  "transliteration": {
    "lo_to_latn": "jaew bong",
    "hm_to_latn": "kua txob jeow bong"
  },
  "pronunciation": {
    "lo": "jèew bɔ̌ɔng",
    "hm": "kua txob jeow bong"
  },
  "category": "Condiment",
  "description": {
    "en": "A rich, slightly sweet and savory chili dip made from dried chiles, fish sauce, and palm sugar; served with fresh vegetables.",
    "lo": "ນ້ຳຈິ້ມເຜັດລົດເຂັ້ມ ມີຄວາມຫວານນ້ອຍໆ ເຮັດຈາກໝາກເຜັດແຫ້ງ ນ້ຳປາ ແລະ ນ້ຳຕານອ້ອຍ ນິຍົມກິນກັບຜັກສົດ",
    "hm": "kua txob qab ntsim me ntsis qab zib, ua los ntawm kua txob qhuav, ntses ntses thiab qab zib, feem ntau noj nrog zaub tshiab"
  },
  "ingredients": ["dried chiles", "fish sauce", "palm sugar", "garlic"],
  "allergens": ["fish"],
  "price": 8000,
  "currency": "LAK",
  "image": "https://upload.wikimedia.org/wikipedia/commons/5/5d/Jeow_Bong_-_Laotian_chili_dip.jpg",
  "tags": ["condiment", "spicy"],
  "cultural_notes": {
    "en": "Commonly served at the start of a meal alongside raw vegetables.",
    "lo": "ມັກເສີບໃນຕອນເລີ່ມມື້ອາຫານ ກິນຄູ່ກັບຜັກສົດ",
    "hm": "feem ntau muab rau thaum pib noj mov, noj nrog zaub tshiab"
  },
  "spice_level": 3,
  "recommended_pairings": ["Sticky Rice", "Grilled Meats"],
  "availability": "All day",
  "preparation_time_minutes": 15
},
    {
      "id": "muu_haeng",
      "name": {"en": "Muu Haeng (Sun-Dried Pork)", "lo": "Muu Haeng (placeholder)", "hm": "Muu Haeng (placeholder)"},
      "transliteration": {"lo_to_latn": "muu haeng", "hm_to_latn": "muu haeng"},
      "pronunciation": {"lo": "[lao pronunciation placeholder]", "hm": "[hmong pronunciation placeholder]"},
      "category": "Snack",
      "description": {"en": "Thinly sliced, marinated pork that's sun-dried then often fried or served as a salty-sweet snack."},
      "ingredients": ["pork", "soy", "garlic"],
      "allergens": [],
      "price": 12000,
      "currency": "LAK",
      "image": "https://hannaone.com/wp-content/uploads/2023/03/the-fork-is-dipping-into-deep-fried-sun-dried-pork-in-white-dish-with-kaffir-lime.jpg",
      "tags": ["snack", "savory"],
      "cultural_notes": {"en": "A preserved meat commonly eaten as a snack or side dish."},
      "spice_level": 1,
      "recommended_pairings": ["Jaew Bong", "Sticky Rice"],
      "availability": "All day",
      "preparation_time_minutes": 30
    },
    {
      "id": "siin_haeng",
      "name": {"en": "Siin Haeng (Sun-Dried Beef)", "lo": "Siin Haeng (placeholder)", "hm": "Siin Haeng (placeholder)"},
      "transliteration": {"lo_to_latn": "siin haeng", "hm_to_latn": "siin haeng"},
      "pronunciation": {"lo": "[lao pronunciation placeholder]", "hm": "[hmong pronunciation placeholder]"},
      "category": "Snack",
      "description": {"en": "Chewy, thinly sliced dried beef seasoned with savory marinades; often served with dipping sauces."},
      "ingredients": ["beef", "soy", "garlic"],
      "allergens": [],
      "price": 13000,
      "currency": "LAK",
      "image": "https://wfg32p.s3.amazonaws.com/media/dishes/siin_haeng_3694.jpg",
      "tags": ["snack", "savory"],
      "cultural_notes": {"en": "Prepared similarly to jerky and commonly enjoyed at markets."},
      "spice_level": 1,
      "recommended_pairings": ["Sticky Rice", "Jaew Bong"],
      "availability": "All day",
      "preparation_time_minutes": 30
    },
    {
      "id": "sai_oua",
      "name": {"en": "Sai Oua (Herbed Pork Sausage)", "lo": "Sai Oua (placeholder)", "hm": "Sai Oua (placeholder)"},
      "transliteration": {"lo_to_latn": "sai oua", "hm_to_latn": "sai oua"},
      "pronunciation": {"lo": "[lao pronunciation placeholder]", "hm": "[hmong pronunciation placeholder]"},
      "category": "Snack",
      "description": {"en": "A fragrant pork sausage seasoned with lemongrass, galangal, and herbs; grilled or fried."},
      "ingredients": ["pork", "lemongrass", "galangal"],
      "allergens": [],
      "price": 15000,
      "currency": "LAK",
      "image": "https://craftstocrumbs.com/wp-content/uploads/2017/10/Sai-Oua-CTC-768x518.jpg",
      "tags": ["grilled", "sausage"],
      "cultural_notes": {"en": "A popular market and street-food item with aromatic herbs."},
      "spice_level": 2,
      "recommended_pairings": ["Sticky Rice", "Fresh Vegetables"],
      "availability": "All day",
      "preparation_time_minutes": 20
    },
    {
      "id": "tam_muk_muang",
      "name": {"en": "Tam Muk Muang (Green-Mango Salad)", "lo": "Tam Muk Muang (placeholder)", "hm": "Tam Muk Muang (placeholder)"},
      "transliteration": {"lo_to_latn": "tam muk muang", "hm_to_latn": "tam muk muang"},
      "pronunciation": {"lo": "[lao pronunciation placeholder]", "hm": "[hmong pronunciation placeholder]"},
      "category": "Starter",
      "description": {"en": "A tart, crunchy salad of shredded green mango tossed with dressing, nuts, and sometimes shrimp."},
      "ingredients": ["green mango", "lime", "nuts", "shrimp"],
      "allergens": ["shellfish", "nuts"],
      "price": 16000,
      "currency": "LAK",